{"type":"LineString","coordinates":[[-111.56379,34.04188,1051.9],[-111.563798,34.042112,1051.9],[-111.564006,34.042346,1056.3],[-111.563959,34.042392,1055.9],[-111.563802,34.042139,1052.5],[-111.563569,34.042119,1053.2],[-111.563242,34.042255,1058.7],[-111.562941,34.042275,1061.0],[-111.56229,34.042188,1065.7],[-111.561875,34.042197,1071.7],[-111.561264,34.042104,1081.0],[-111.560731,34.041956,1081.6],[-111.55999,34.042097,1084.8],[-111.558985,34.042541,1083.2],[-111.558392,34.043098,1079.7],[-111.558048,34.04317,1080.7],[-111.557463,34.043091,1067.7],[-111.557002,34.043391,1054.1],[-111.556729,34.043454,1050.3],[-111.556675,34.043567,1050.6],[-111.556519,34.04358,1049.3],[-111.556489,34.043689,1050.0],[-111.55643,34.04371,1049.2],[-111.55632,34.043637,1048.0],[-111.556273,34.043493,1047.7],[-111.555752,34.043647,1050.5],[-111.554265,34.044632,1055.3],[-111.55379,34.044851,1057.4],[-111.552948,34.045348,1061.6],[-111.55239,34.045495,1067.1],[-111.55181,34.045437,1077.0],[-111.551431,34.045459,1079.4],[-111.551322,34.04548,1078.0],[-111.55132,34.04558,1079.5]],"cum_m":[0.0,25.8,58.1,64.8,96.5,118.0,151.8,179.6,240.3,278.6,335.8,387.6,457.7,562.6,645.2,677.9,732.5,786.5,812.6,826.1,840.6,853.0,858.9,871.9,888.5,939.5,1114.9,1165.0,1260.2,1314.2,1368.0,1403.0,1413.3,1424.4],"derived":{"arc":{"track":"38408_Sheep_Cree.gpx#0","from":1373,"to":1455,"reversed":false},"source":{"file":"38408_Sheep_Cree.gpx","date":"2017-11-18"},"elevation":"USGS 3DEP, bilinear (see tools/elevation.py)","gain_threshold_m":3.0,"cleaning":{"spike_perp_m":25.0,"arrive_m":10.0,"consensus_near_m":5.0,"consensus_far_m":10.0,"consensus_step_m":5.0,"simplify_m":3.3},"consensus":{"passes":["35933_Club_Ranch.gpx#0","37747_Club_Ranch.gpx#0","38408_Sheep_Cree.gpx#0"],"voted_fraction":0.982,"mean_shift_m":1.0,"max_shift_m":3.4},"trimmed_points":{}}}