{"type":"LineString","coordinates":[[-111.71168,34.1632,719.8],[-111.71136,34.16334,722.3],[-111.71056,34.16395,731.3],[-111.70969,34.164,738.7],[-111.70961,34.16407,741.1],[-111.70922,34.16418,747.4],[-111.70911,34.16435,749.1],[-111.70872,34.16444,754.4],[-111.70847,34.16443,756.6],[-111.70748,34.16409,770.2],[-111.70723,34.16426,770.0],[-111.70695,34.16431,768.3],[-111.70679,34.16441,768.6],[-111.70349,34.1655,790.5],[-111.70338,34.16543,789.6],[-111.70323,34.16551,793.3],[-111.7033,34.16573,799.0],[-111.70278,34.16568,806.3],[-111.70257,34.16581,810.8],[-111.70257,34.16598,814.4],[-111.70227,34.16595,820.3],[-111.70207,34.166,825.3],[-111.70212,34.1661,828.3],[-111.70172,34.16622,835.9],[-111.70162,34.1663,837.5],[-111.70074,34.16616,844.9],[-111.7004,34.16602,844.3],[-111.70006,34.16581,845.3],[-111.6998,34.16577,845.0],[-111.69934,34.16593,848.1],[-111.69907,34.1663,850.3],[-111.69898,34.16673,859.2],[-111.69889,34.16685,862.5],[-111.69906,34.16719,867.9],[-111.69925,34.16738,870.6],[-111.69919,34.16754,873.9],[-111.69921,34.16785,877.5],[-111.69927,34.1679,877.4],[-111.69921,34.16797,878.5],[-111.69921,34.16816,880.0],[-111.69932,34.1687,882.6],[-111.69931,34.16895,884.0],[-111.6994,34.16909,884.8],[-111.6994,34.16938,887.9],[-111.69928,34.16955,891.3],[-111.69911,34.16954,893.0],[-111.69899,34.16961,895.2],[-111.69895,34.16973,897.0],[-111.69903,34.16983,897.2],[-111.69886,34.17016,901.7],[-111.6983,34.17057,908.4],[-111.69816,34.17076,910.0],[-111.69761,34.17108,911.4],[-111.69751,34.17109,911.7],[-111.69725,34.17126,911.7],[-111.69715,34.1714,911.7],[-111.69685,34.17154,913.6],[-111.6967,34.17169,913.7],[-111.69633,34.17189,916.4],[-111.69535,34.17219,920.2],[-111.69461,34.17261,921.7],[-111.69432,34.17269,922.6],[-111.69441,34.17284,922.6],[-111.69409,34.17287,924.3],[-111.69377,34.17311,926.3],[-111.69356,34.1732,927.8],[-111.69352,34.17332,928.0],[-111.69288,34.17361,932.0],[-111.69241,34.17388,934.5],[-111.69233,34.17401,934.4],[-111.69207,34.17407,936.7],[-111.69192,34.17418,936.8],[-111.69141,34.17412,936.7],[-111.69104,34.17414,934.9],[-111.6906,34.17424,932.4],[-111.69032,34.17422,932.1],[-111.68953,34.17462,933.5],[-111.68919,34.17469,935.2],[-111.68912,34.17466,935.5],[-111.6891,34.1747,935.5],[-111.68892,34.17466,936.5],[-111.68873,34.17468,937.3],[-111.68852,34.17478,937.3],[-111.68794,34.1749,933.9],[-111.68762,34.17504,931.1],[-111.68738,34.1752,929.2],[-111.6873,34.17534,927.9],[-111.68717,34.17541,926.8],[-111.68711,34.17554,925.8],[-111.68675,34.17578,920.3],[-111.6866,34.176,917.0],[-111.68587,34.1765,913.3],[-111.68591,34.1765,913.1],[-111.68596,34.17665,912.8],[-111.68585,34.17682,913.1],[-111.68587,34.17696,913.0]],"cum_m":[0.0,33.3,133.4,213.6,224.3,262.3,283.7,321.0,344.0,442.6,472.4,498.7,517.2,844.1,856.9,873.3,898.6,946.7,970.9,989.8,1017.6,1036.8,1048.8,1088.0,1100.8,1183.2,1218.2,1257.2,1281.5,1327.4,1375.5,1424.0,1439.7,1480.6,1508.1,1526.7,1561.2,1569.0,1578.6,1599.7,1660.6,1688.4,1706.1,1738.3,1760.2,1775.9,1789.4,1803.2,1816.6,1856.4,1925.2,1950.0,2011.8,2021.1,2051.6,2069.7,2101.4,2123.0,2163.7,2259.8,2342.4,2370.5,2389.1,2418.7,2458.5,2480.2,2494.1,2561.2,2613.8,2630.1,2654.9,2673.3,2720.7,2754.8,2796.8,2822.7,2907.9,2940.1,2947.3,2952.2,2969.3,2986.9,3009.2,3064.2,3097.5,3125.9,3143.1,3157.4,3172.8,3215.4,3243.5,3330.6,3334.3,3351.6,3373.1,3388.7],"derived":{"arc":{"track":"48135_Red_Crk___.gpx#0","from":667,"to":894,"reversed":false},"source":{"file":"48135_Red_Crk___.gpx","date":"2018-11-11"},"elevation":"USGS 3DEP, bilinear (see tools/elevation.py)","gain_threshold_m":3.0,"cleaning":{"spike_perp_m":25.0,"simplify_m":3.3}}}