{"type":"LineString","coordinates":[[-111.44721,34.00254,1842.2],[-111.446526,34.002366,1849.1],[-111.44618,34.002196,1850.3],[-111.445579,34.002342,1860.5],[-111.445289,34.002296,1862.2],[-111.445085,34.002066,1860.7],[-111.444743,34.00186,1862.5],[-111.444635,34.001295,1862.2],[-111.444485,34.001269,1864.4],[-111.44384,34.001426,1869.9],[-111.443781,34.001395,1870.4],[-111.443802,34.0015,1869.1],[-111.443484,34.001936,1863.8],[-111.443262,34.002087,1862.3],[-111.442884,34.002224,1857.7],[-111.442476,34.002543,1850.3],[-111.442404,34.002919,1844.8],[-111.442043,34.003415,1846.3],[-111.44184,34.00358,1847.4],[-111.441327,34.003816,1849.7],[-111.441208,34.003919,1849.6],[-111.441067,34.004183,1848.8],[-111.440297,34.005051,1852.3],[-111.439881,34.005351,1858.7],[-111.439437,34.005547,1862.2],[-111.438868,34.006068,1856.4],[-111.437894,34.006673,1853.5],[-111.437648,34.00692,1856.7],[-111.43766,34.00722,1848.9]],"cum_m":[0.0,66.0,103.0,160.8,188.0,219.7,258.7,322.3,336.4,398.4,404.8,416.7,473.3,499.8,537.8,589.5,631.9,696.3,722.5,776.6,792.4,824.5,944.3,995.2,1041.5,1119.7,1231.9,1267.5,1300.9],"derived":{"arc":{"track":"37172_South_Fork.gpx#0","from":517,"to":580,"reversed":true},"source":{"file":"37172_South_Fork.gpx","date":"2017-07-08"},"elevation":"USGS 3DEP, bilinear (see tools/elevation.py)","gain_threshold_m":3.0,"cleaning":{"spike_perp_m":25.0,"arrive_m":10.0,"consensus_near_m":5.0,"consensus_far_m":10.0,"consensus_step_m":5.0,"simplify_m":3.3},"consensus":{"passes":["36737_Deer_Creek.gpx#0","37172_South_Fork.gpx#0"],"voted_fraction":0.977,"mean_shift_m":0.85,"max_shift_m":2.67},"trimmed_points":{}}}