{"type":"LineString","coordinates":[[-111.48372,33.90915,1121.7],[-111.483853,33.909259,1126.0],[-111.483775,33.909659,1123.0],[-111.483922,33.909746,1124.3],[-111.484326,33.909856,1128.5],[-111.484664,33.90983,1130.8],[-111.485422,33.909555,1129.6],[-111.485953,33.909669,1127.0],[-111.486303,33.90963,1128.5],[-111.486709,33.909698,1131.1],[-111.48724,33.909585,1132.1],[-111.487468,33.909662,1133.5],[-111.487593,33.909849,1134.8],[-111.487774,33.909916,1135.6],[-111.4882,33.909936,1137.5],[-111.488631,33.909882,1138.8],[-111.489279,33.909973,1144.3],[-111.489942,33.910371,1146.9],[-111.49025,33.910382,1148.3],[-111.490596,33.910215,1149.9],[-111.490727,33.910216,1151.0],[-111.490912,33.91042,1155.1],[-111.491346,33.910706,1157.8],[-111.491818,33.911335,1171.7],[-111.492041,33.911547,1177.0],[-111.492178,33.91179,1184.0],[-111.49237,33.91197,1189.8],[-111.49264,33.912046,1193.8],[-111.492914,33.912037,1200.2],[-111.49315,33.91213,1204.2]],"cum_m":[0.0,17.2,62.3,79.0,118.2,149.5,225.9,276.5,309.1,347.3,397.9,420.6,444.4,462.7,502.0,542.3,602.9,678.4,706.9,743.8,755.9,784.3,835.4,917.8,949.1,979.0,1005.7,1032.0,1057.3,1081.4],"derived":{"arc":{"track":"36991_S_Mazatzal.gpx#0","from":2,"to":59,"reversed":false},"source":{"file":"36991_S_Mazatzal.gpx","date":"2017-06-11"},"elevation":"USGS 3DEP, bilinear (see tools/elevation.py)","gain_threshold_m":3.0,"cleaning":{"spike_perp_m":25.0,"arrive_m":10.0,"consensus_near_m":5.0,"consensus_far_m":10.0,"consensus_step_m":5.0,"simplify_m":3.3},"consensus":{"passes":["36991_S_Mazatzal.gpx#0","RS_BlackRidgeLoop-Mazat_184205.gpx#0","RS_LittleSaddleMountain_174900.gpx#0"],"voted_fraction":1.0,"mean_shift_m":0.97,"max_shift_m":2.86},"trimmed_points":{"15":0}}}