{"type":"LineString","coordinates":[[-111.49039,34.10702,1811.2],[-111.490803,34.107214,1812.2],[-111.491397,34.107588,1815.4],[-111.491591,34.108135,1818.7],[-111.491571,34.108602,1821.6],[-111.491453,34.109107,1825.9],[-111.491273,34.109361,1826.4],[-111.491401,34.109454,1828.1],[-111.491416,34.109529,1828.5],[-111.491296,34.110319,1828.9],[-111.49113,34.110605,1830.6],[-111.490843,34.110935,1837.1],[-111.490739,34.111178,1839.4],[-111.490452,34.11144,1844.3],[-111.490387,34.11165,1844.3],[-111.490813,34.111521,1847.7],[-111.491149,34.111695,1851.8],[-111.491416,34.112031,1856.3],[-111.49136,34.11256,1859.8]],"cum_m":[0.0,43.7,112.4,175.8,227.8,285.0,317.7,333.4,341.8,430.4,465.7,510.9,539.6,578.9,603.0,644.7,681.2,726.0,785.0],"derived":{"arc":{"track":"33886_Rock_Creek.gpx#3","from":362,"to":397,"reversed":true},"source":{"file":"33886_Rock_Creek.gpx","date":"2016-09-23"},"elevation":"USGS 3DEP, bilinear (see tools/elevation.py)","gain_threshold_m":3.0,"cleaning":{"spike_perp_m":25.0,"arrive_m":10.0,"consensus_near_m":5.0,"consensus_far_m":10.0,"consensus_step_m":5.0,"simplify_m":3.3},"consensus":{"passes":["33886_Rock_Creek.gpx#3","35935_Mazatzal_P.gpx#0","37747_Club_Ranch.gpx#0","40409_Barnhardt_.gpx#0","RS_NorthForkFallsofDead_174147.gpx#0"],"voted_fraction":1.0,"mean_shift_m":1.19,"max_shift_m":3.8},"trimmed_points":{}}}