{"type":"LineString","coordinates":[[-111.49985,34.14984,1804.5],[-111.49991,34.15065,1810.2],[-111.49979,34.15117,1810.2],[-111.49978,34.15191,1807.5],[-111.49987,34.15218,1805.5],[-111.5002,34.15238,1808.5],[-111.50021,34.15243,1809.5],[-111.49998,34.15251,1811.2],[-111.50003,34.15261,1813.5],[-111.50078,34.15262,1818.1],[-111.50104,34.1528,1823.8],[-111.50162,34.15279,1826.0],[-111.50217,34.15318,1835.6],[-111.50259,34.15319,1840.7],[-111.50276,34.15326,1843.5],[-111.503,34.15327,1845.5],[-111.50319,34.15335,1848.9],[-111.50355,34.15341,1851.6],[-111.5042,34.1539,1862.4],[-111.50462,34.15406,1866.9],[-111.50468,34.15416,1869.9],[-111.50549,34.15442,1878.5],[-111.50582,34.15472,1883.9],[-111.50577,34.1547,1883.7],[-111.50579,34.15465,1883.2],[-111.50577,34.15469,1883.5],[-111.50587,34.15481,1884.7],[-111.50589,34.15477,1884.5],[-111.50603,34.15558,1879.1],[-111.50614,34.15565,1879.9],[-111.50649,34.15609,1880.1],[-111.50687,34.15636,1880.3],[-111.50724,34.15646,1882.0],[-111.50782,34.1565,1881.6],[-111.50831,34.15641,1880.2],[-111.50936,34.15678,1866.6],[-111.50978,34.15684,1861.9],[-111.51008,34.15694,1858.0],[-111.51109,34.15709,1854.2],[-111.51144,34.15727,1850.1],[-111.5117,34.15752,1845.4],[-111.5119,34.15762,1840.2],[-111.51259,34.15729,1831.8],[-111.51272,34.1573,1832.7],[-111.51274,34.15774,1834.4],[-111.51308,34.15796,1833.7],[-111.51362,34.158,1830.3],[-111.5136,34.15812,1832.3],[-111.51344,34.15812,1831.1],[-111.51301,34.15853,1845.0],[-111.51253,34.15859,1845.4],[-111.51181,34.15914,1856.5],[-111.51144,34.15927,1859.3],[-111.51138,34.15937,1863.2],[-111.51098,34.15952,1864.9],[-111.51045,34.15988,1871.0],[-111.51009,34.16006,1872.8],[-111.50984,34.16031,1870.3],[-111.50956,34.16045,1867.2],[-111.50937,34.16061,1863.1],[-111.50914,34.1607,1860.5],[-111.50888,34.16101,1853.6],[-111.5088,34.16102,1853.1],[-111.50882,34.16109,1850.8],[-111.5087,34.1612,1847.4],[-111.50871,34.16125,1845.8],[-111.50805,34.16189,1832.9],[-111.50783,34.16203,1832.0],[-111.50783,34.16213,1830.6],[-111.50757,34.16266,1827.3],[-111.50732,34.16283,1826.9],[-111.50708,34.16314,1827.0],[-111.50691,34.16321,1827.3],[-111.5068,34.16342,1827.7],[-111.50641,34.16371,1829.0],[-111.50612,34.16384,1829.3],[-111.506,34.16411,1830.5],[-111.50586,34.16446,1832.8],[-111.50586,34.1646,1834.4],[-111.50603,34.16476,1836.5],[-111.50604,34.16486,1837.9],[-111.50569,34.16508,1840.1],[-111.50571,34.16518,1841.3],[-111.50587,34.16524,1842.7],[-111.50599,34.16542,1845.2],[-111.50586,34.16567,1848.8],[-111.50604,34.16573,1850.4],[-111.50617,34.16591,1854.5],[-111.5061,34.16607,1857.9],[-111.50646,34.16628,1863.5],[-111.50629,34.16634,1865.8],[-111.50742,34.16702,1884.8],[-111.50764,34.1672,1890.9],[-111.50819,34.16743,1897.1],[-111.50863,34.16803,1911.1],[-111.50881,34.16817,1913.1],[-111.50886,34.16827,1914.4],[-111.5088,34.16866,1914.5],[-111.50894,34.16883,1914.7],[-111.50906,34.16914,1912.6],[-111.50913,34.16947,1910.0],[-111.50911,34.16967,1907.6],[-111.5093,34.17043,1905.3],[-111.50935,34.17106,1897.8],[-111.50918,34.17127,1896.4],[-111.50905,34.17166,1896.9],[-111.50895,34.17178,1896.1],[-111.50895,34.17206,1897.3],[-111.50876,34.17241,1899.1],[-111.50857,34.17304,1902.7],[-111.50831,34.17327,1901.7],[-111.50817,34.17352,1899.7],[-111.50789,34.17365,1896.1],[-111.50752,34.17397,1892.8],[-111.50746,34.17417,1890.2],[-111.50732,34.17428,1888.2],[-111.50723,34.17421,1888.3],[-111.5073,34.17429,1888.2],[-111.50729,34.17454,1885.1],[-111.50716,34.17475,1881.3],[-111.50669,34.17501,1873.7],[-111.50629,34.17548,1867.2],[-111.50621,34.17563,1867.9],[-111.50623,34.17578,1866.9],[-111.50618,34.17589,1866.7],[-111.50622,34.17592,1865.9],[-111.50621,34.1762,1863.9],[-111.50608,34.17657,1862.1],[-111.50593,34.17675,1864.1],[-111.50576,34.17757,1861.1],[-111.5055,34.17799,1859.0],[-111.50535,34.17807,1859.7],[-111.5052,34.17855,1854.4],[-111.50505,34.17864,1854.3]],"cum_m":[0.0,90.2,149.1,231.4,262.5,300.2,305.8,328.8,340.8,409.8,441.0,494.4,561.0,599.7,617.2,639.3,658.9,692.7,773.6,816.2,828.6,908.5,953.6,958.7,964.6,969.4,985.6,990.4,1081.4,1094.2,1152.8,1198.8,1234.7,1288.2,1334.4,1439.4,1478.6,1508.4,1602.8,1640.7,1677.4,1698.9,1772.2,1784.2,1833.2,1872.9,1922.8,1936.3,1951.0,2011.4,2056.0,2146.2,2183.2,2195.6,2236.0,2299.1,2337.8,2373.9,2404.0,2428.9,2452.3,2494.3,2501.7,2509.7,2526.2,2531.8,2625.4,2650.9,2662.0,2725.6,2755.4,2796.4,2813.8,2839.3,2887.5,2917.9,2949.9,2990.8,3006.4,3030.1,3041.3,3081.7,3093.0,3109.1,3132.0,3162.3,3180.1,3203.4,3222.3,3262.9,3279.9,3408.4,3436.9,3493.6,3571.6,3594.4,3606.4,3650.1,3673.0,3709.2,3746.4,3768.7,3855.0,3925.2,3953.4,3998.3,4014.5,4045.7,4088.3,4160.5,4195.6,4226.2,4255.7,4305.0,4327.9,4345.7,4357.0,4368.0,4395.8,4422.0,4474.1,4538.0,4556.2,4573.0,4586.1,4591.0,4622.2,4665.0,4689.3,4781.8,4834.3,4850.7,4905.9,4922.9],"derived":{"arc":{"track":"35761_City_Creek.gpx#0","from":1065,"to":1339,"reversed":false},"source":{"file":"35761_City_Creek.gpx","date":"2017-03-26"},"elevation":"USGS 3DEP, bilinear (see tools/elevation.py)","gain_threshold_m":3.0,"cleaning":{"spike_perp_m":25.0,"arrive_m":10.0,"consensus_near_m":5.0,"consensus_far_m":10.0,"consensus_step_m":5.0,"simplify_m":3.3},"consensus":{"passes":["33886_Rock_Creek.gpx#3","35761_City_Creek.gpx#0","38742_Fuller_See.gpx#0"],"voted_fraction":0.007,"mean_shift_m":0.0,"max_shift_m":1.06},"trimmed_points":{}}}