{"type":"LineString","coordinates":[[-111.47864,34.08595,1838.8],[-111.478722,34.086154,1837.3],[-111.478897,34.086286,1835.5],[-111.479047,34.086362,1834.4],[-111.479275,34.086364,1833.5],[-111.479949,34.086176,1832.2],[-111.481244,34.085639,1824.2],[-111.482213,34.085442,1819.2],[-111.483062,34.085185,1812.5],[-111.484613,34.085318,1805.1],[-111.485064,34.085514,1802.2],[-111.485295,34.085837,1799.5],[-111.486032,34.086122,1797.1],[-111.486827,34.086025,1801.0],[-111.487426,34.085799,1801.7],[-111.487724,34.085579,1801.5],[-111.487872,34.08533,1800.3],[-111.48794,34.0853,1799.6],[-111.488312,34.085264,1796.7],[-111.48927,34.085481,1786.3],[-111.490058,34.085376,1778.7],[-111.490676,34.085361,1770.7],[-111.490932,34.085446,1768.5],[-111.490924,34.085545,1772.5],[-111.490806,34.08571,1782.4],[-111.490942,34.085544,1771.9],[-111.49094,34.085404,1766.4],[-111.491268,34.085505,1761.6],[-111.493,34.086644,1743.2],[-111.4933,34.08675,1740.1]],"cum_m":[0.0,23.9,45.7,61.9,82.9,148.4,281.8,373.7,456.9,600.5,647.4,689.1,764.0,838.0,898.7,935.4,966.3,973.4,1007.9,1099.3,1172.8,1229.8,1255.2,1266.2,1287.5,1309.8,1325.4,1357.6,1561.3,1591.3],"derived":{"arc":{"track":"40409_Barnhardt_.gpx#0","from":1068,"to":1137,"reversed":true},"source":{"file":"40409_Barnhardt_.gpx","date":"2018-06-03"},"elevation":"USGS 3DEP, bilinear (see tools/elevation.py)","gain_threshold_m":3.0,"cleaning":{"spike_perp_m":25.0,"arrive_m":10.0,"consensus_near_m":5.0,"consensus_far_m":10.0,"consensus_step_m":5.0,"simplify_m":3.3},"consensus":{"passes":["33886_Rock_Creek.gpx#0","33886_Rock_Creek.gpx#3","35935_Mazatzal_P.gpx#0","36587_Mazatzal_P.gpx#0","38408_Sheep_Cree.gpx#0","40409_Barnhardt_.gpx#0","RS_NorthForkFallsofDead_174147.gpx#0"],"voted_fraction":1.0,"mean_shift_m":0.88,"max_shift_m":3.47},"trimmed_points":{}}}