{"type":"LineString","coordinates":[[-111.421969,34.092745,1278.8],[-111.422305,34.092615,1281.5],[-111.42284,34.092592,1284.2],[-111.422895,34.092544,1284.9],[-111.424175,34.092565,1291.3],[-111.424892,34.092426,1295.8],[-111.425346,34.092151,1299.6],[-111.425598,34.092078,1300.0],[-111.425718,34.091915,1300.5],[-111.425988,34.091957,1299.9],[-111.426179,34.091609,1298.8],[-111.42633,34.091739,1299.1],[-111.426389,34.091921,1299.8],[-111.426501,34.092043,1301.4],[-111.426763,34.092071,1303.4],[-111.427747,34.091702,1311.0],[-111.427978,34.091558,1313.4],[-111.428135,34.091391,1314.6],[-111.428397,34.091412,1316.3],[-111.428777,34.091306,1318.9],[-111.42922,34.090894,1325.3],[-111.429424,34.090518,1330.2],[-111.429495,34.090491,1329.8],[-111.429791,34.091144,1334.5],[-111.43018,34.091337,1337.7],[-111.430692,34.091396,1338.1],[-111.431654,34.09164,1345.6],[-111.432157,34.091679,1348.7],[-111.432522,34.091791,1353.2],[-111.433119,34.091718,1358.1],[-111.433613,34.091488,1360.7],[-111.434044,34.091931,1365.2],[-111.434299,34.09201,1366.5],[-111.434765,34.092013,1372.2],[-111.435555,34.091722,1375.0],[-111.435885,34.09172,1379.2],[-111.43607,34.091662,1382.6],[-111.436349,34.091456,1385.5],[-111.436553,34.091396,1387.0],[-111.437673,34.091541,1394.8],[-111.438072,34.091488,1396.7],[-111.438287,34.091152,1394.4],[-111.438497,34.091091,1390.5],[-111.439362,34.091349,1396.7],[-111.439869,34.091856,1407.7],[-111.440168,34.09198,1411.5],[-111.440561,34.09187,1414.5],[-111.440908,34.09205,1420.7],[-111.441202,34.09194,1423.5],[-111.44134,34.091756,1424.9],[-111.441542,34.091637,1427.1],[-111.442174,34.091497,1432.4],[-111.442776,34.091753,1439.3],[-111.443559,34.092286,1448.4],[-111.443812,34.092556,1452.4],[-111.443875,34.092446,1453.6],[-111.443778,34.092176,1459.2],[-111.443098,34.091591,1471.6],[-111.443048,34.091469,1472.0],[-111.443409,34.09177,1476.4],[-111.443626,34.091808,1478.5],[-111.443929,34.091445,1482.4],[-111.444058,34.090782,1489.0],[-111.444475,34.090321,1497.3],[-111.4441,34.090485,1501.4],[-111.443606,34.091057,1508.3],[-111.443445,34.091151,1509.0],[-111.443765,34.09043,1522.2],[-111.443898,34.090245,1524.4],[-111.444061,34.089697,1534.7],[-111.44429,34.089532,1537.8],[-111.444094,34.089529,1539.9],[-111.443932,34.089659,1541.9],[-111.443696,34.090043,1543.3],[-111.443337,34.090384,1546.0],[-111.443505,34.090036,1557.2],[-111.443508,34.089826,1563.5],[-111.443576,34.089658,1566.1],[-111.443525,34.0894,1571.2],[-111.443518,34.089527,1571.2],[-111.443355,34.089713,1575.4],[-111.443465,34.089029,1588.0],[-111.443696,34.08885,1592.2],[-111.443933,34.088764,1596.3],[-111.444386,34.088701,1599.8],[-111.444538,34.088578,1600.6],[-111.444709,34.088172,1609.5],[-111.444707,34.087989,1612.3],[-111.44478,34.087894,1613.0],[-111.445133,34.087811,1616.5],[-111.445529,34.087912,1620.1],[-111.445912,34.087929,1633.8],[-111.44621,34.08788,1641.5],[-111.446301,34.087989,1644.4],[-111.446314,34.088491,1652.3],[-111.446401,34.08861,1654.4],[-111.446553,34.088419,1659.1],[-111.446841,34.088311,1663.5],[-111.447067,34.088352,1664.6],[-111.447322,34.08847,1666.9],[-111.44803,34.088594,1673.7],[-111.4489,34.088607,1693.2],[-111.449188,34.088756,1692.3],[-111.449436,34.088647,1690.5],[-111.449564,34.088491,1690.3],[-111.449679,34.087892,1698.5],[-111.449747,34.087833,1698.6],[-111.449859,34.087893,1697.0],[-111.45006,34.088249,1696.6],[-111.450328,34.088509,1699.6],[-111.450978,34.088618,1709.7],[-111.451529,34.088424,1716.2],[-111.451957,34.088068,1725.3],[-111.452341,34.087864,1729.5],[-111.452584,34.087507,1731.7],[-111.452847,34.087373,1729.2],[-111.452939,34.087421,1731.2],[-111.452984,34.087525,1732.5],[-111.453068,34.088054,1742.7],[-111.452554,34.08899,1755.9],[-111.452205,34.08985,1764.8],[-111.452173,34.090096,1768.1],[-111.452695,34.090609,1777.0],[-111.452738,34.090975,1778.0],[-111.453022,34.091861,1785.3],[-111.45313,34.092019,1785.3],[-111.453308,34.092123,1784.3],[-111.453938,34.092079,1783.3],[-111.454186,34.091978,1783.0],[-111.454283,34.091863,1783.0],[-111.454982,34.090434,1789.4],[-111.45555,34.089511,1796.6],[-111.455636,34.08908,1798.3],[-111.455781,34.088737,1798.7],[-111.456154,34.088518,1797.4],[-111.456581,34.088359,1796.9],[-111.457131,34.087473,1798.2],[-111.457361,34.087339,1795.9],[-111.457812,34.087333,1796.5],[-111.458072,34.087466,1797.4],[-111.458568,34.087855,1800.1]],"cum_m":[0.0,34.2,83.5,90.8,208.7,276.5,328.3,352.9,374.1,399.4,442.0,462.0,483.0,500.0,524.3,623.8,650.4,674.0,698.2,735.1,796.5,842.3,849.5,927.1,968.8,1016.4,1109.1,1155.6,1191.4,1247.0,1299.2,1362.4,1387.5,1430.4,1510.0,1540.4,1558.6,1593.1,1613.0,1717.4,1754.6,1796.9,1817.4,1902.0,1975.2,2006.0,2044.2,2081.9,2111.6,2135.7,2158.6,2218.8,2281.1,2374.5,2412.5,2426.0,2457.3,2547.6,2561.9,2609.1,2629.5,2678.6,2753.3,2817.3,2856.4,2934.6,2952.7,3038.1,3062.1,3124.8,3152.8,3170.8,3191.6,3239.5,3289.8,3331.5,3354.8,3374.5,3403.6,3417.8,3443.3,3520.0,3549.2,3573.0,3615.3,3634.9,3682.7,3703.0,3715.5,3749.3,3787.5,3822.8,3850.8,3865.5,3921.4,3936.8,3962.3,3991.4,4012.7,4039.6,4106.2,4186.4,4217.6,4243.5,4264.5,4331.9,4341.0,4353.3,4397.0,4435.0,4496.0,4551.2,4607.0,4649.0,4694.6,4723.1,4733.1,4745.4,4804.7,4919.0,5019.9,5047.4,5122.0,5162.9,5264.8,5285.0,5305.1,5363.3,5388.7,5404.3,5575.8,5691.0,5739.5,5780.0,5822.1,5865.2,5976.0,6001.9,6043.4,6071.5,6134.4],"derived":{"arc":{"track":"RS_SandySaddleTM12_231525.gpx#0","from":1257,"to":2005,"reversed":true},"source":{"file":"RS_SandySaddleTM12_231525.gpx","date":"2026-05-23"},"elevation":"USGS 3DEP, bilinear (see tools/elevation.py)","gain_threshold_m":3.0,"cleaning":{"spike_perp_m":25.0,"arrive_m":10.0,"consensus_near_m":5.0,"consensus_far_m":10.0,"consensus_step_m":5.0,"simplify_m":3.3},"consensus":{"passes":["33886_Rock_Creek.gpx#0","35935_Mazatzal_P.gpx#0","36587_Mazatzal_P.gpx#0","37747_Club_Ranch.gpx#0","38408_Sheep_Cree.gpx#0","40409_Barnhardt_.gpx#0","RS_NorthForkFallsofDead_174147.gpx#0","RS_SandySaddleTM12_231525.gpx#0"],"voted_fraction":1.0,"mean_shift_m":1.07,"max_shift_m":4.12},"trimmed_points":{}}}