{"type":"LineString","coordinates":[[-111.67671,33.94513,582.1],[-111.67604,33.94513,581.4],[-111.67549,33.94501,579.8],[-111.67501,33.94504,580.2],[-111.67346,33.94442,584.0],[-111.67281,33.94427,582.8],[-111.67251,33.94425,583.5],[-111.67242,33.94419,584.5],[-111.67207,33.94417,586.9],[-111.67192,33.94408,587.7],[-111.67113,33.94399,592.2],[-111.67078,33.9441,588.7],[-111.67073,33.94407,588.1],[-111.67075,33.94392,586.4],[-111.67063,33.94341,592.2],[-111.66972,33.94333,593.9],[-111.66945,33.94326,596.1],[-111.6689,33.94296,599.8],[-111.66798,33.94281,600.6],[-111.6677,33.94291,601.8],[-111.66729,33.94322,603.0],[-111.66708,33.94329,603.8],[-111.66695,33.94325,602.6],[-111.66699,33.94333,603.7],[-111.66681,33.9436,605.3],[-111.6666,33.94386,606.6],[-111.66641,33.94398,607.3],[-111.66633,33.94415,608.5],[-111.66608,33.94427,604.3],[-111.6655,33.94436,591.9],[-111.66536,33.94444,594.6],[-111.66526,33.94472,594.4],[-111.66522,33.94468,596.3],[-111.66486,33.94483,597.6],[-111.66489,33.94478,597.5],[-111.66486,33.94473,602.3],[-111.6648,33.94474,601.1],[-111.66479,33.94464,607.4],[-111.66486,33.94462,607.0],[-111.66485,33.94453,607.6],[-111.66451,33.94428,609.7],[-111.66461,33.94417,612.1],[-111.6645,33.94401,615.7],[-111.66433,33.94399,616.8],[-111.66429,33.9439,618.6],[-111.66418,33.94392,618.6],[-111.66404,33.94375,623.1],[-111.66402,33.94362,625.8],[-111.66379,33.9436,628.3],[-111.66376,33.94356,629.3],[-111.66376,33.94327,636.8],[-111.66369,33.94304,642.8],[-111.66373,33.9428,646.6],[-111.66359,33.94259,647.1],[-111.66365,33.94245,643.7],[-111.66365,33.94211,636.8],[-111.66375,33.9419,633.5],[-111.66386,33.94178,631.1],[-111.66404,33.94169,625.8],[-111.66422,33.94138,619.4],[-111.66411,33.94137,620.6],[-111.6638,33.94108,620.4],[-111.66272,33.94046,611.0],[-111.66249,33.93976,606.6],[-111.66235,33.93962,603.5],[-111.66227,33.93941,599.1],[-111.66222,33.93938,598.2],[-111.66205,33.93943,595.3],[-111.66204,33.93952,593.8],[-111.66197,33.93955,594.2],[-111.66189,33.93948,595.0],[-111.66177,33.93947,595.5],[-111.66174,33.93935,596.0],[-111.66165,33.93928,595.5],[-111.66153,33.93927,595.3],[-111.66157,33.93919,596.4],[-111.66146,33.93906,601.4],[-111.6609,33.93892,604.5],[-111.66052,33.93845,602.9],[-111.66028,33.93843,601.4],[-111.66017,33.93831,602.9],[-111.65959,33.93813,597.2],[-111.65902,33.93822,604.0],[-111.65873,33.93803,607.9],[-111.65868,33.93804,608.1],[-111.65858,33.93786,609.7],[-111.65823,33.93768,611.9],[-111.65813,33.93749,612.0],[-111.65795,33.93736,612.3],[-111.65791,33.93711,615.9],[-111.65779,33.93684,617.3],[-111.65751,33.93649,619.6],[-111.65721,33.93645,620.5],[-111.65721,33.93631,620.7],[-111.65688,33.93613,623.5],[-111.65675,33.93597,622.1],[-111.65637,33.93579,625.7],[-111.6562,33.93579,627.1],[-111.65562,33.93565,629.1],[-111.65519,33.93546,624.0],[-111.65474,33.93538,616.3],[-111.65469,33.93543,616.6],[-111.65458,33.93542,617.5],[-111.65432,33.93528,623.3],[-111.65361,33.93518,625.4],[-111.65313,33.93497,626.1],[-111.65261,33.93507,628.2],[-111.65225,33.93501,626.3],[-111.65208,33.93504,623.8],[-111.65196,33.93499,623.4],[-111.65196,33.9348,622.2],[-111.65183,33.93464,622.9],[-111.65129,33.93456,624.4],[-111.65106,33.9344,627.5],[-111.65088,33.93438,628.2],[-111.65068,33.93428,629.3],[-111.65057,33.93431,629.2],[-111.65021,33.93427,630.5],[-111.6501,33.93416,631.2],[-111.64994,33.9341,632.0],[-111.64953,33.93414,632.1],[-111.64934,33.93404,633.0],[-111.64905,33.93406,633.3],[-111.64862,33.93401,634.9],[-111.64844,33.9339,636.4],[-111.64839,33.93394,635.5],[-111.64831,33.93388,636.3],[-111.64814,33.93389,635.9],[-111.64806,33.93383,636.8],[-111.64773,33.93375,636.8],[-111.64754,33.93364,637.4],[-111.64748,33.93365,635.0],[-111.64741,33.93351,635.3],[-111.64711,33.93327,638.3],[-111.64719,33.93298,640.0],[-111.64704,33.9327,641.7],[-111.64703,33.93251,642.5],[-111.64685,33.93225,644.7],[-111.6467,33.93218,645.9],[-111.64662,33.932,648.4],[-111.64627,33.93193,657.4],[-111.64604,33.93194,663.0],[-111.64563,33.93177,672.3],[-111.64535,33.93187,670.9],[-111.64518,33.93183,668.7],[-111.64485,33.93218,672.0],[-111.64453,33.93232,673.4],[-111.64431,33.93237,675.2],[-111.64428,33.93227,674.5],[-111.64395,33.93225,677.1],[-111.64393,33.93241,678.4],[-111.64383,33.93254,677.7],[-111.64357,33.93274,677.6],[-111.64332,33.93275,676.4],[-111.64321,33.93268,674.4],[-111.64297,33.93267,673.6],[-111.64275,33.9326,672.8],[-111.64254,33.9325,671.6],[-111.64254,33.93245,670.8],[-111.64198,33.93227,673.6],[-111.64178,33.93216,674.7],[-111.64144,33.93163,673.0],[-111.64056,33.93051,666.2],[-111.64023,33.9298,667.3],[-111.64001,33.92948,666.3],[-111.63964,33.92914,663.1],[-111.63936,33.92907,658.8],[-111.63913,33.92907,655.0],[-111.63915,33.92902,655.7],[-111.63904,33.92898,652.9],[-111.63902,33.92902,652.9],[-111.63885,33.92894,649.4],[-111.63874,33.92899,647.2],[-111.63866,33.92913,643.3],[-111.63845,33.92921,638.3],[-111.63845,33.92926,638.1],[-111.63827,33.92938,633.8],[-111.6381,33.92936,632.5],[-111.63802,33.92943,630.6],[-111.63813,33.92965,622.6],[-111.63799,33.92973,617.8],[-111.63795,33.92981,613.6],[-111.63811,33.93002,615.8],[-111.63815,33.93022,617.4],[-111.63824,33.93028,618.5],[-111.63818,33.93027,618.3],[-111.63818,33.93055,633.5],[-111.63806,33.9306,636.1],[-111.63786,33.93051,638.1],[-111.63771,33.93036,637.7],[-111.63721,33.9303,643.3],[-111.63702,33.93016,641.5],[-111.63692,33.93,640.8],[-111.63685,33.93,640.6],[-111.63675,33.93005,638.6],[-111.63674,33.93015,637.0],[-111.63663,33.93016,634.5],[-111.6366,33.93036,631.1],[-111.63651,33.93042,628.1],[-111.6364,33.93044,625.2],[-111.6362,33.93036,621.9],[-111.63603,33.93038,617.5],[-111.63594,33.93026,617.6],[-111.63583,33.93024,621.9],[-111.63545,33.93045,627.6],[-111.63517,33.93054,628.7],[-111.63511,33.93078,630.8],[-111.63491,33.93095,632.4],[-111.63426,33.93102,630.4],[-111.63408,33.93114,627.4],[-111.63378,33.93113,620.6],[-111.63352,33.93106,614.6],[-111.63347,33.93098,614.0],[-111.63329,33.93095,612.1],[-111.63324,33.93099,611.4],[-111.63312,33.93098,611.3],[-111.63285,33.93088,610.0],[-111.63243,33.93086,607.8],[-111.63225,33.93066,607.1],[-111.6318,33.93057,605.6],[-111.63145,33.93036,604.7],[-111.63128,33.93032,604.4],[-111.63116,33.93036,604.1],[-111.63104,33.93034,603.5],[-111.63071,33.92971,601.4],[-111.6308,33.92959,600.7],[-111.6308,33.92943,599.9],[-111.63045,33.92921,598.8],[-111.63047,33.92916,598.0],[-111.63039,33.92909,597.8],[-111.63014,33.92915,595.8],[-111.63008,33.92896,596.0],[-111.63016,33.92886,600.8],[-111.6301,33.92887,597.9],[-111.63009,33.92874,596.0],[-111.63002,33.92867,594.6],[-111.63,33.92833,593.3],[-111.63008,33.92815,592.7],[-111.63063,33.92795,593.2],[-111.6309,33.9276,590.9],[-111.63146,33.9273,589.4],[-111.63156,33.92713,589.7],[-111.63167,33.92711,590.0],[-111.63175,33.92703,590.2],[-111.6318,33.92689,589.9],[-111.63202,33.92684,589.3],[-111.63226,33.92688,589.3],[-111.63222,33.92675,589.7],[-111.63231,33.92682,588.8],[-111.63242,33.92683,588.6],[-111.63265,33.92669,588.0],[-111.63282,33.9264,587.6],[-111.6328,33.92625,588.0],[-111.6329,33.92613,587.4],[-111.63283,33.92607,589.6]],"cum_m":[0.0,61.8,114.3,158.7,317.4,379.6,407.4,418.0,450.4,467.5,541.0,575.6,581.3,598.0,655.8,740.2,766.3,827.1,913.5,941.7,992.8,1013.7,1026.5,1036.1,1070.4,1105.2,1127.3,1147.6,1174.2,1228.6,1244.3,1276.8,1282.6,1319.7,1325.9,1332.2,1337.8,1349.0,1355.8,1365.8,1407.7,1423.1,1443.5,1459.4,1470.0,1480.4,1503.3,1517.9,1539.2,1544.5,1576.7,1603.1,1630.0,1656.7,1673.2,1711.1,1736.2,1752.9,1772.3,1810.6,1820.8,1863.9,1985.0,2065.7,2085.9,2110.4,2116.1,2132.8,2142.8,2150.1,2160.8,2171.9,2185.6,2196.9,2208.1,2217.7,2235.4,2289.3,2352.2,2374.5,2391.3,2448.4,2501.9,2536.0,2540.7,2562.8,2600.8,2623.8,2645.8,2673.9,2705.9,2752.6,2780.6,2796.2,2832.6,2854.1,2894.4,2910.1,2965.9,3010.8,3053.3,3060.5,3070.7,3099.3,3165.7,3215.8,3265.0,3298.9,3314.9,3327.3,3348.5,3369.9,3420.5,3448.2,3465.0,3486.5,3497.2,3530.7,3546.6,3562.8,3600.9,3621.6,3648.5,3688.5,3709.2,3715.6,3725.5,3741.2,3751.2,3782.9,3804.3,3809.9,3826.8,3865.2,3898.3,3932.4,3953.5,3986.9,4002.7,4024.1,4057.3,4078.5,4120.8,4149.0,4165.3,4214.7,4248.0,4269.1,4280.5,4311.1,4329.0,4346.1,4378.8,4401.9,4414.7,4436.9,4458.6,4480.9,4486.5,4541.9,4564.0,4630.8,4779.5,4864.1,4905.1,4956.0,4983.0,5004.2,5010.1,5021.1,5025.9,5044.0,5055.6,5072.8,5094.1,5099.7,5121.0,5136.8,5147.5,5174.0,5189.7,5199.3,5227.0,5249.5,5260.2,5265.8,5296.9,5309.3,5330.3,5352.0,5398.6,5422.0,5442.1,5448.5,5459.3,5470.5,5480.7,5503.1,5513.7,5524.1,5544.6,5560.5,5576.2,5586.6,5628.7,5656.4,5683.6,5710.1,5770.5,5791.8,5819.5,5844.8,5854.8,5871.7,5878.1,5889.2,5916.5,5955.3,5983.1,6025.8,6065.6,6082.0,6093.9,6105.2,6181.6,6197.3,6215.1,6255.6,6261.4,6272.2,6296.2,6318.0,6331.4,6337.0,6351.5,6361.6,6399.5,6420.8,6476.2,6522.4,6583.9,6604.9,6615.3,6626.9,6643.1,6664.2,6686.8,6701.7,6713.1,6723.3,6749.6,6785.4,6802.2,6818.4,6827.7],"derived":{"arc":{"track":"39258_Fig_Trail_.gpx#0","from":252,"to":738,"reversed":false},"source":{"file":"39258_Fig_Trail_.gpx","date":"2018-02-11"},"elevation":"USGS 3DEP, bilinear (see tools/elevation.py)","gain_threshold_m":3.0,"cleaning":{"spike_perp_m":25.0,"simplify_m":3.3}}}