{"type":"LineString","coordinates":[[-111.49258,34.08484,1725.7],[-111.492492,34.084698,1725.5],[-111.492347,34.084595,1725.9],[-111.492503,34.084374,1725.1],[-111.49248,34.08412,1724.5],[-111.49251,34.08416,1724.5],[-111.49245,34.0842,1724.9],[-111.4922,34.08405,1725.7],[-111.49196,34.0841,1725.9],[-111.49187,34.08405,1725.7],[-111.4919,34.084,1725.5],[-111.49202,34.08399,1725.7],[-111.4921,34.08406,1725.7],[-111.49225,34.08398,1725.2],[-111.49248,34.08405,1724.2],[-111.49251,34.08401,1723.6],[-111.49242,34.08381,1722.2],[-111.4924,34.0834,1712.8],[-111.49224,34.08308,1705.6],[-111.49227,34.08298,1701.9],[-111.49236,34.08293,1699.4],[-111.49231,34.08284,1697.0],[-111.49209,34.08279,1692.7],[-111.49174,34.08289,1688.7],[-111.49128,34.08293,1681.9],[-111.49112,34.08302,1680.5],[-111.49083,34.08296,1677.6],[-111.49038,34.08301,1669.7],[-111.49011,34.08294,1666.6],[-111.48987,34.08279,1669.2],[-111.48992,34.08252,1670.2],[-111.48988,34.08248,1670.8],[-111.4899,34.0822,1667.0],[-111.4897,34.0821,1668.9],[-111.48968,34.08197,1674.7],[-111.48959,34.0819,1676.8],[-111.48994,34.08117,1683.0],[-111.49035,34.08048,1693.9],[-111.4903,34.07967,1701.7],[-111.49022,34.07961,1703.0],[-111.49029,34.07975,1702.2],[-111.49023,34.07976,1703.2],[-111.48996,34.07944,1704.8],[-111.489,34.07917,1704.3],[-111.48869,34.07921,1703.7],[-111.48847,34.07935,1709.1],[-111.48796,34.07927,1714.5],[-111.48787,34.07899,1713.7],[-111.48808,34.07882,1706.8],[-111.48825,34.07882,1701.0],[-111.48825,34.07857,1703.1],[-111.48818,34.07842,1705.3],[-111.48749,34.078,1706.6],[-111.48711,34.07763,1705.3],[-111.48687,34.07748,1710.2],[-111.48664,34.07705,1708.3],[-111.48613,34.07666,1706.7],[-111.48597,34.07645,1703.7],[-111.48609,34.07631,1699.8],[-111.48601,34.07607,1697.1],[-111.48624,34.07593,1700.2],[-111.48626,34.07588,1700.5],[-111.48618,34.07581,1702.0],[-111.48626,34.07575,1700.7],[-111.48626,34.07561,1699.9],[-111.48637,34.07536,1688.6],[-111.48647,34.07532,1682.0],[-111.48657,34.07537,1680.7],[-111.48657,34.07545,1682.4],[-111.48649,34.07538,1683.5],[-111.48652,34.07528,1683.3],[-111.48664,34.07526,1687.2],[-111.48652,34.07536,1681.0],[-111.48645,34.07527,1683.5],[-111.48629,34.07524,1684.9],[-111.48607,34.07509,1686.8],[-111.48614,34.07517,1688.4],[-111.48608,34.07525,1693.6],[-111.48616,34.07512,1685.6],[-111.48612,34.07509,1686.1],[-111.48617,34.0751,1685.9],[-111.48635,34.07521,1685.3],[-111.48645,34.07539,1685.9],[-111.48629,34.07558,1698.9],[-111.48624,34.07561,1700.3],[-111.48612,34.07557,1703.2],[-111.48607,34.07566,1703.7],[-111.48561,34.07535,1709.9],[-111.4854,34.07536,1713.3],[-111.48499,34.07519,1719.4],[-111.48488,34.07521,1721.9],[-111.48491,34.07517,1720.1],[-111.48474,34.07497,1706.7],[-111.48479,34.07484,1703.0],[-111.48469,34.0748,1707.9],[-111.4846,34.07467,1709.7],[-111.48448,34.07468,1713.5],[-111.48427,34.07452,1733.1],[-111.48392,34.07445,1742.3],[-111.48408,34.07414,1749.8],[-111.4842,34.07403,1748.2],[-111.48471,34.07386,1757.0],[-111.48492,34.07384,1757.4],[-111.48514,34.07368,1756.4],[-111.485391,34.073354,1760.1],[-111.48533,34.07347,1759.0]],"cum_m":[0.0,17.7,35.3,63.8,92.1,97.4,104.5,132.9,155.7,165.7,171.9,183.0,193.7,210.1,232.7,237.9,261.7,307.3,345.8,357.3,367.2,378.3,399.3,433.4,476.0,493.8,521.3,563.1,589.2,616.9,647.2,653.0,684.2,705.7,720.3,731.7,819.0,904.5,994.7,1004.6,1021.5,1027.1,1070.5,1163.9,1192.8,1218.3,1266.1,1298.4,1325.4,1341.1,1368.9,1386.7,1465.6,1519.6,1547.3,1599.6,1663.5,1691.2,1710.2,1737.9,1764.2,1770.1,1780.8,1790.7,1806.3,1835.9,1846.1,1856.9,1865.8,1876.5,1887.9,1899.2,1914.9,1926.8,1941.9,1968.2,1979.1,1989.6,2005.8,2010.8,2015.5,2036.2,2058.2,2083.9,2089.6,2101.5,2112.6,2167.2,2186.6,2228.8,2239.2,2244.4,2271.6,2286.8,2297.0,2313.7,2324.8,2351.0,2384.2,2421.7,2438.2,2488.8,2508.3,2535.2,2578.2,2592.3],"derived":{"arc":{"track":"36587_Mazatzal_P.gpx#0","from":495,"to":688,"reversed":false},"source":{"file":"36587_Mazatzal_P.gpx","date":"2017-05-06"},"elevation":"USGS 3DEP, bilinear (see tools/elevation.py)","gain_threshold_m":3.0,"cleaning":{"spike_perp_m":25.0,"arrive_m":10.0,"consensus_near_m":5.0,"consensus_far_m":10.0,"consensus_step_m":5.0,"simplify_m":3.3},"consensus":{"passes":["35935_Mazatzal_P.gpx#0","36587_Mazatzal_P.gpx#0"],"voted_fraction":0.041,"mean_shift_m":0.04,"max_shift_m":1.9},"trimmed_points":{}}}