{"type":"LineString","coordinates":[[-111.47249,34.00475,1708.6],[-111.472659,34.004605,1707.3],[-111.472642,34.004255,1712.3],[-111.472794,34.00417,1715.4],[-111.473048,34.00415,1716.7],[-111.473271,34.004227,1719.7],[-111.474253,34.003931,1725.4],[-111.4747,34.004035,1722.2],[-111.475444,34.003854,1726.6],[-111.47569,34.003306,1734.6],[-111.475677,34.003131,1736.7],[-111.475335,34.002906,1740.2],[-111.475552,34.002411,1747.5],[-111.47581,34.002306,1748.0],[-111.476239,34.002478,1753.0],[-111.477083,34.002233,1760.5],[-111.477271,34.002078,1761.9],[-111.47734,34.00212,1764.5]],"cum_m":[0.0,22.4,61.4,78.3,101.8,124.1,220.4,263.2,334.6,399.7,419.2,459.4,518.0,544.5,588.4,670.8,695.3,703.2],"derived":{"arc":{"track":"36737_Deer_Creek.gpx#0","from":647,"to":671,"reversed":false},"source":{"file":"36737_Deer_Creek.gpx","date":"2017-05-20"},"elevation":"USGS 3DEP, bilinear (see tools/elevation.py)","gain_threshold_m":3.0,"cleaning":{"spike_perp_m":25.0,"arrive_m":10.0,"consensus_near_m":5.0,"consensus_far_m":10.0,"consensus_step_m":5.0,"simplify_m":3.3},"consensus":{"passes":["36737_Deer_Creek.gpx#0","36991_S_Mazatzal.gpx#0","RS_MountPeeleySummit_196419.gpx#0"],"voted_fraction":1.0,"mean_shift_m":2.41,"max_shift_m":3.74},"trimmed_points":{}}}