{"type":"LineString","coordinates":[[-111.71135,33.98279,605.2],[-111.70986,33.98332,608.9],[-111.70784,33.98337,620.3],[-111.70774,33.98124,627.2],[-111.70803,33.9805,622.4],[-111.70819,33.97969,616.6],[-111.70846,33.97889,609.4],[-111.70895,33.97815,605.3],[-111.70896,33.97731,605.4],[-111.70883,33.97647,606.0],[-111.7086,33.97563,603.9],[-111.70768,33.97348,601.4],[-111.70446,33.97141,601.6],[-111.70364,33.97093,598.9],[-111.70219,33.97018,595.2],[-111.70088,33.96939,589.4],[-111.69713,33.96967,580.4],[-111.69615,33.96997,582.3],[-111.69535,33.97041,584.1],[-111.69443,33.97057,584.7],[-111.69343,33.97035,583.6],[-111.69265,33.96994,581.8],[-111.69085,33.96936,583.6],[-111.68903,33.96863,582.2],[-111.68762,33.96909,581.7],[-111.68703,33.96974,582.7],[-111.68632,33.97035,586.1],[-111.68558,33.9709,589.0],[-111.68472,33.97135,588.0],[-111.68379,33.97171,588.7],[-111.68311,33.97232,589.3],[-111.68257,33.97301,589.6],[-111.6824,33.97364,591.8],[-111.6819,33.97472,594.1],[-111.68131,33.9753,595.2]],"cum_m":[0.0,149.5,335.8,572.8,659.4,750.6,843.0,936.9,1030.3,1124.5,1220.2,1473.9,1849.6,1942.2,2099.8,2249.1,2596.3,2692.7,2781.2,2867.9,2963.3,3048.4,3226.5,3413.0,3552.7,3643.2,3737.4,3829.1,3922.8,4017.5,4109.9,4201.3,4273.1,4401.7,4486.1],"derived":{"arc":{"track":"36135_Copper_Cam.gpx#0","from":1012,"to":1057,"reversed":true},"source":{"file":"36135_Copper_Cam.gpx","date":"2017-04-14"},"elevation":"USGS 3DEP, bilinear (see tools/elevation.py)","gain_threshold_m":3.0,"cleaning":{"spike_perp_m":25.0,"simplify_m":3.3}}}