{"type":"LineString","coordinates":[[-111.60276,34.09327,1175.0],[-111.60291,34.09342,1175.9],[-111.603,34.09331,1175.5],[-111.60297,34.09341,1176.2],[-111.60301,34.09342,1176.3],[-111.60305,34.09333,1175.4],[-111.60312,34.09336,1175.6],[-111.60295,34.09335,1175.9],[-111.60301,34.09343,1176.4],[-111.6029,34.09336,1175.7],[-111.60311,34.09337,1175.8],[-111.6031,34.0935,1177.8],[-111.60307,34.09348,1177.0],[-111.60308,34.09345,1176.8],[-111.60317,34.09355,1179.5],[-111.60332,34.09361,1181.9],[-111.60329,34.09394,1189.3],[-111.60308,34.09416,1192.8],[-111.60313,34.09443,1199.4],[-111.60321,34.09455,1203.4],[-111.60306,34.09488,1205.3],[-111.60314,34.09497,1209.3],[-111.60304,34.09509,1209.6],[-111.60305,34.09525,1211.0],[-111.60328,34.09564,1217.8],[-111.6032,34.09594,1218.9],[-111.60344,34.0962,1221.5],[-111.6036,34.09623,1222.6],[-111.60338,34.09684,1232.1],[-111.6034,34.09706,1235.9],[-111.60346,34.09715,1236.4],[-111.60341,34.0973,1236.9],[-111.60332,34.09736,1239.3],[-111.60318,34.09725,1242.1],[-111.60253,34.09712,1253.5],[-111.60231,34.0971,1255.2],[-111.60166,34.09718,1266.0],[-111.60128,34.09686,1267.5],[-111.60098,34.09687,1271.4],[-111.6003,34.09701,1281.9],[-111.60007,34.09697,1283.1],[-111.60002,34.09686,1282.4],[-111.59982,34.09683,1285.2],[-111.59977,34.09666,1285.9],[-111.59962,34.09654,1288.0],[-111.59932,34.09648,1292.3],[-111.59925,34.09639,1290.2],[-111.59782,34.09644,1290.5],[-111.5973,34.09638,1292.0],[-111.59721,34.09643,1294.1],[-111.59705,34.09643,1296.3],[-111.59618,34.09618,1307.0],[-111.5957,34.09639,1317.6],[-111.59556,34.0964,1319.3],[-111.59526,34.09626,1321.0],[-111.59505,34.09636,1323.6],[-111.59462,34.09626,1325.8],[-111.5945,34.09636,1328.5],[-111.59437,34.09638,1330.7],[-111.59409,34.0966,1337.4],[-111.59383,34.09636,1341.2],[-111.59341,34.09608,1346.3],[-111.59302,34.09594,1352.5],[-111.59326,34.09655,1360.1],[-111.59319,34.09664,1363.2],[-111.59265,34.09637,1375.0],[-111.59201,34.09614,1386.8],[-111.59207,34.0966,1398.6],[-111.59217,34.09673,1399.7],[-111.59215,34.09681,1401.3],[-111.59161,34.09643,1407.7],[-111.59114,34.09629,1414.5],[-111.59133,34.09653,1419.1],[-111.59135,34.09669,1423.5],[-111.5912,34.0967,1428.5],[-111.59108,34.09704,1438.1],[-111.59094,34.09703,1442.3],[-111.59076,34.09709,1447.0],[-111.59059,34.09722,1449.3],[-111.5905,34.09723,1451.3],[-111.59044,34.09736,1452.1],[-111.59035,34.09739,1454.4],[-111.59025,34.09728,1456.6],[-111.58999,34.09728,1460.0],[-111.58984,34.09722,1461.0],[-111.58949,34.09735,1463.2],[-111.5893,34.09749,1466.9],[-111.58879,34.09751,1470.9],[-111.58873,34.09756,1472.3],[-111.58886,34.09767,1473.3],[-111.58882,34.09781,1476.4],[-111.58867,34.09787,1479.8],[-111.58851,34.09787,1481.8],[-111.5884,34.09794,1484.5],[-111.58816,34.09789,1486.8],[-111.58748,34.09801,1502.8],[-111.587,34.0978,1507.9],[-111.58684,34.09778,1510.6],[-111.58678,34.09784,1513.0],[-111.58644,34.09774,1519.4],[-111.58626,34.09777,1523.2],[-111.58617,34.09774,1524.4],[-111.58611,34.09784,1526.0],[-111.58571,34.09777,1526.6],[-111.58553,34.09786,1524.9],[-111.58523,34.09788,1519.7],[-111.585,34.09782,1514.7],[-111.58491,34.09773,1513.7],[-111.58446,34.09764,1503.4],[-111.58425,34.0974,1500.1],[-111.5839,34.09807,1485.5],[-111.58382,34.09814,1483.7],[-111.58365,34.09818,1479.6],[-111.58332,34.09868,1472.0],[-111.58321,34.09889,1471.3],[-111.58321,34.09911,1472.8],[-111.58311,34.09927,1472.7],[-111.58238,34.09928,1463.6],[-111.58173,34.09912,1458.0],[-111.58158,34.09918,1461.3],[-111.58131,34.09919,1461.3],[-111.581,34.09918,1459.9],[-111.58061,34.09907,1452.5],[-111.58046,34.09909,1450.7],[-111.58019,34.0993,1447.5],[-111.58002,34.09957,1446.4],[-111.57981,34.09976,1442.6],[-111.57967,34.09978,1439.3],[-111.57961,34.09984,1438.2],[-111.5796,34.10003,1438.0],[-111.57945,34.10019,1434.0],[-111.57924,34.10028,1429.4],[-111.57889,34.10065,1426.8],[-111.57859,34.10072,1423.5],[-111.57804,34.10095,1429.2],[-111.57791,34.10094,1428.5],[-111.57775,34.101,1429.8],[-111.57726,34.10099,1430.6],[-111.57708,34.10108,1433.4],[-111.57681,34.10107,1434.5],[-111.57608,34.10119,1442.3],[-111.57586,34.10114,1444.6]],"cum_m":[0.0,21.7,36.4,47.9,51.7,62.4,69.7,85.4,95.8,108.6,128.0,142.5,146.0,149.5,163.3,178.7,215.5,246.6,277.0,292.3,331.5,343.9,360.1,377.9,426.2,460.3,496.7,511.8,582.6,607.2,618.6,635.9,646.5,664.3,725.9,746.3,806.8,856.7,884.3,948.8,970.5,983.5,1002.3,1021.7,1040.9,1069.3,1081.2,1213.0,1261.4,1271.4,1286.1,1370.9,1420.9,1433.8,1465.5,1487.8,1529.0,1544.6,1556.8,1592.3,1628.2,1677.8,1717.0,1788.3,1800.2,1858.3,1922.6,1974.0,1991.1,2000.2,2065.5,2111.5,2143.4,2161.3,2175.1,2214.5,2227.5,2245.3,2266.6,2275.0,2290.5,2299.4,2314.7,2338.6,2354.0,2389.3,2412.7,2459.7,2467.6,2484.7,2500.7,2516.0,2530.8,2543.5,2566.3,2630.3,2680.3,2695.2,2703.9,2737.1,2754.0,2762.9,2775.4,2813.0,2832.4,2860.1,2882.3,2895.3,2937.9,2970.9,3052.0,3062.8,3079.0,3142.4,3167.8,3192.3,3212.3,3279.6,3342.0,3357.3,3382.2,3410.8,3448.7,3462.7,3496.8,3530.7,3559.3,3572.4,3581.1,3602.2,3624.7,3646.5,3698.8,3727.5,3784.2,3796.2,3812.4,3857.5,3876.9,3901.8,3970.3,3991.3],"derived":{"arc":{"track":"47532_Midnight_M.gpx#0","from":714,"to":1032,"reversed":false},"source":{"file":"47532_Midnight_M.gpx","date":"2018-09-03"},"elevation":"USGS 3DEP, bilinear (see tools/elevation.py)","gain_threshold_m":3.0,"cleaning":{"spike_perp_m":25.0,"simplify_m":3.3}}}