{"type":"LineString","coordinates":[[-111.49326,34.08676,1741.1],[-111.49418,34.08784,1742.7],[-111.4947,34.0883,1744.5],[-111.49498,34.08862,1745.4],[-111.49571,34.08915,1741.6],[-111.4962,34.09024,1742.1],[-111.49689,34.09082,1741.0],[-111.49689,34.09096,1740.0],[-111.49634,34.09135,1734.6],[-111.49596,34.09169,1731.5],[-111.49571,34.09205,1725.8],[-111.49531,34.09248,1720.1],[-111.49515,34.09255,1721.5],[-111.49516,34.09261,1721.8],[-111.49551,34.09275,1720.5],[-111.49633,34.09297,1728.1],[-111.49641,34.09293,1724.8],[-111.49673,34.09312,1725.6],[-111.49689,34.09338,1728.0],[-111.49703,34.09346,1724.6],[-111.49709,34.09371,1729.1],[-111.49723,34.09395,1729.2],[-111.49745,34.09417,1730.5],[-111.49799,34.09448,1729.7],[-111.49798,34.09472,1730.6],[-111.49791,34.0952,1733.2],[-111.49767,34.09592,1736.2],[-111.49743,34.09638,1737.4],[-111.49724,34.09661,1738.4],[-111.49731,34.09694,1740.6],[-111.49719,34.09727,1742.1],[-111.49681,34.09815,1746.3],[-111.49649,34.09858,1749.4],[-111.49609,34.09877,1747.2],[-111.4951,34.09881,1742.4],[-111.49502,34.09887,1741.5],[-111.49492,34.09932,1739.4],[-111.49468,34.09945,1744.5],[-111.49426,34.09979,1740.9],[-111.49388,34.09984,1741.4],[-111.49369,34.09994,1742.4],[-111.49358,34.10004,1741.2],[-111.49358,34.10008,1741.4],[-111.49362,34.10003,1739.6],[-111.49377,34.10001,1736.8],[-111.49361,34.10002,1740.9],[-111.49368,34.10006,1737.6],[-111.49368,34.10013,1738.9],[-111.49367,34.10002,1738.5],[-111.49355,34.10001,1741.4],[-111.4936,34.10018,1743.1],[-111.49396,34.10046,1747.5],[-111.49412,34.10074,1752.1],[-111.4941,34.10079,1753.8],[-111.4935,34.10056,1760.1],[-111.49372,34.10098,1765.6],[-111.49374,34.10146,1770.3],[-111.4939,34.10187,1774.3],[-111.49406,34.10207,1775.2],[-111.49394,34.10231,1779.1],[-111.49401,34.10282,1781.4],[-111.49383,34.10319,1787.6],[-111.49362,34.10329,1790.7],[-111.49351,34.10373,1794.4],[-111.49253,34.1052,1807.3],[-111.49264,34.10531,1807.9],[-111.49262,34.10545,1807.1],[-111.49233,34.10557,1804.7],[-111.49233,34.10616,1807.4],[-111.49213,34.10687,1809.5],[-111.49197,34.10693,1809.5],[-111.49047,34.10681,1812.9],[-111.49039,34.10695,1810.5],[-111.49043,34.10707,1811.5]],"cum_m":[0.0,147.0,217.0,261.0,350.4,479.7,570.2,585.8,652.5,704.0,750.2,810.5,827.2,833.9,869.7,949.1,957.7,994.0,1026.4,1042.1,1070.4,1100.1,1131.8,1192.3,1219.0,1272.8,1355.8,1411.6,1442.5,1479.8,1518.1,1622.0,1678.2,1720.7,1811.9,1821.9,1872.7,1899.2,1953.2,1988.7,2009.4,2024.4,2028.9,2035.5,2049.5,2064.3,2072.1,2079.9,2092.2,2103.3,2122.8,2168.2,2202.7,2208.5,2269.4,2320.3,2373.7,2421.6,2448.3,2477.2,2534.3,2578.6,2600.9,2650.9,2837.6,2853.5,2869.1,2899.0,2964.6,3045.7,3061.8,3200.6,3217.8,3231.7],"derived":{"arc":{"track":"35935_Mazatzal_P.gpx#0","from":901,"to":1043,"reversed":false},"source":{"file":"35935_Mazatzal_P.gpx","date":"2016-04-02"},"elevation":"USGS 3DEP, bilinear (see tools/elevation.py)","gain_threshold_m":3.0,"cleaning":{"spike_perp_m":25.0,"simplify_m":3.3}}}