{"type":"LineString","coordinates":[[-111.70819,34.07794,637.5],[-111.708023,34.077913,630.1],[-111.706641,34.077265,635.2],[-111.706556,34.076959,634.6],[-111.705986,34.07681,637.2],[-111.705862,34.076709,635.7],[-111.70563,34.076234,629.5],[-111.705312,34.076111,629.9],[-111.70502,34.075905,631.5],[-111.704452,34.075715,630.0],[-111.7043,34.075599,631.7],[-111.703991,34.075665,632.1],[-111.703329,34.075664,631.0],[-111.703137,34.075706,627.5],[-111.703105,34.07578,627.5],[-111.70315,34.07588,630.1],[-111.703346,34.076112,637.0],[-111.70323,34.07622,639.5]],"cum_m":[0.0,15.7,161.9,196.8,251.9,267.9,324.9,357.2,392.5,449.0,468.0,497.4,558.4,576.7,585.4,597.3,628.7,644.8],"derived":{"arc":{"track":"40522_Sheep_Brid.gpx#0","from":2387,"to":2434,"reversed":true},"source":{"file":"40522_Sheep_Brid.gpx","date":"2019-06-09"},"elevation":"USGS 3DEP, bilinear (see tools/elevation.py)","gain_threshold_m":3.0,"cleaning":{"spike_perp_m":25.0,"arrive_m":10.0,"consensus_near_m":5.0,"consensus_far_m":10.0,"consensus_step_m":5.0,"simplify_m":3.3},"consensus":{"passes":["38315_Verde_Rive.gpx#0","40522_Sheep_Brid.gpx#0","47532_Midnight_M.gpx#0"],"voted_fraction":1.0,"mean_shift_m":1.57,"max_shift_m":4.05},"trimmed_points":{"1H":1}}}