{"type":"LineString","coordinates":[[-111.49039,34.10702,1811.2],[-111.49136,34.10751,1814.7],[-111.49157,34.10801,1817.5],[-111.49155,34.10855,1822.3],[-111.49159,34.1086,1821.1],[-111.49142,34.10919,1827.3],[-111.49126,34.10939,1827.1],[-111.49139,34.10946,1828.6],[-111.4914,34.1096,1829.4],[-111.4913,34.11032,1828.9],[-111.49083,34.11093,1837.6],[-111.49075,34.11114,1839.1],[-111.49038,34.11153,1846.8],[-111.49038,34.11166,1844.6],[-111.49081,34.1115,1847.1],[-111.49112,34.11166,1851.2],[-111.49142,34.11203,1856.3],[-111.49136,34.11256,1859.8]],"cum_m":[0.0,104.6,163.5,223.6,230.2,297.7,324.3,338.6,354.2,434.8,515.3,539.7,594.9,609.3,652.7,686.4,735.9,795.1],"derived":{"arc":{"track":"33886_Rock_Creek.gpx#3","from":362,"to":397,"reversed":true},"source":{"file":"33886_Rock_Creek.gpx","date":"2016-09-23"},"elevation":"USGS 3DEP, bilinear (see tools/elevation.py)","gain_threshold_m":3.0,"cleaning":{"spike_perp_m":25.0,"simplify_m":3.3}}}