{"type":"LineString","coordinates":[[-111.68103,33.97551,595.4],[-111.68024,33.975825,597.4],[-111.680051,33.975762,595.8],[-111.679914,33.975792,594.1],[-111.679446,33.976179,597.6],[-111.678827,33.976432,598.2],[-111.678166,33.976801,599.6],[-111.677489,33.977003,600.3],[-111.67746,33.97705,601.2]],"cum_m":[0.0,80.8,99.6,112.7,173.6,237.3,310.7,377.1,382.9],"derived":{"arc":{"track":"35933_Club_Ranch.gpx#0","from":1835,"to":1847,"reversed":true},"source":{"file":"35933_Club_Ranch.gpx","date":"2016-03-05"},"elevation":"USGS 3DEP, bilinear (see tools/elevation.py)","gain_threshold_m":3.0,"cleaning":{"spike_perp_m":25.0,"arrive_m":10.0,"consensus_near_m":5.0,"consensus_far_m":10.0,"consensus_step_m":5.0,"simplify_m":3.3},"consensus":{"passes":["35933_Club_Ranch.gpx#0","36135_Copper_Cam.gpx#0"],"voted_fraction":1.0,"mean_shift_m":1.21,"max_shift_m":3.61},"trimmed_points":{}}}