{"type":"LineString","coordinates":[[-111.54784,34.2049,1551.4],[-111.5479,34.20456,1545.2],[-111.54812,34.20433,1543.9],[-111.54824,34.20429,1544.6],[-111.54828,34.2042,1543.1],[-111.54804,34.20417,1541.5],[-111.54776,34.20421,1538.1],[-111.54748,34.20432,1530.5],[-111.54737,34.2043,1528.8],[-111.5473,34.20416,1528.0],[-111.54723,34.20367,1520.1],[-111.54734,34.20319,1512.2],[-111.54664,34.20332,1504.5],[-111.54656,34.2032,1505.0],[-111.5466,34.203,1502.4],[-111.54656,34.2028,1500.4],[-111.54597,34.20267,1498.2],[-111.54571,34.20232,1486.4],[-111.54572,34.20222,1488.2],[-111.54584,34.20211,1490.2],[-111.54572,34.20201,1492.5],[-111.54569,34.20183,1500.4],[-111.54555,34.20167,1503.2],[-111.5455,34.20133,1511.7],[-111.54527,34.2015,1511.9],[-111.54529,34.20179,1502.0],[-111.54518,34.20204,1502.8],[-111.54486,34.20218,1505.9],[-111.54455,34.20221,1505.7],[-111.54445,34.20216,1507.3],[-111.54444,34.2021,1509.8],[-111.54462,34.20213,1510.8],[-111.54473,34.20209,1512.4],[-111.5449,34.20189,1516.5],[-111.54493,34.20122,1535.8],[-111.54499,34.2011,1537.4],[-111.54495,34.20107,1538.8],[-111.54477,34.2012,1541.4],[-111.54449,34.20129,1544.8],[-111.54432,34.20127,1546.2],[-111.54425,34.2012,1548.2],[-111.54422,34.20111,1551.4],[-111.54442,34.20093,1555.6],[-111.54466,34.20052,1564.3],[-111.54464,34.20048,1565.4],[-111.54435,34.20063,1568.7],[-111.544,34.20067,1572.4],[-111.54401,34.20062,1573.4],[-111.5442,34.20052,1576.7],[-111.54439,34.20028,1581.6],[-111.54449,34.19989,1588.3],[-111.54437,34.20007,1589.7],[-111.54419,34.20019,1592.8],[-111.54355,34.20029,1598.7],[-111.54345,34.20036,1599.0],[-111.54338,34.20029,1601.9],[-111.54362,34.20014,1604.5],[-111.54394,34.19984,1610.0],[-111.54429,34.19921,1621.2],[-111.54468,34.19878,1629.2],[-111.54483,34.19869,1634.5],[-111.54509,34.19878,1636.9],[-111.54535,34.19865,1643.2],[-111.5455,34.19871,1643.3],[-111.54561,34.19869,1643.6],[-111.54582,34.19856,1646.2],[-111.54611,34.19848,1649.1],[-111.54706,34.19794,1666.9],[-111.54721,34.19767,1664.3],[-111.54733,34.19685,1650.4],[-111.54733,34.1969,1650.8],[-111.54714,34.1967,1648.6],[-111.54676,34.19673,1646.1],[-111.54662,34.1968,1647.4],[-111.54583,34.19693,1649.6],[-111.5454,34.1971,1649.8],[-111.54528,34.1971,1648.1],[-111.54499,34.19703,1649.8],[-111.54465,34.19671,1649.7],[-111.54419,34.19656,1649.2],[-111.54383,34.19659,1650.2],[-111.54355,34.19667,1650.8],[-111.5429,34.19663,1646.8],[-111.54237,34.19676,1646.4],[-111.54208,34.19701,1643.5],[-111.54194,34.19732,1638.8],[-111.54181,34.19674,1629.1],[-111.54179,34.19679,1629.2],[-111.54178,34.19616,1619.7],[-111.54172,34.19601,1617.1],[-111.54159,34.1959,1617.1],[-111.54154,34.19539,1617.2],[-111.54155,34.19529,1615.7],[-111.5417,34.19521,1617.3],[-111.54185,34.19494,1618.9],[-111.54185,34.19479,1618.5],[-111.54175,34.19465,1616.1],[-111.54178,34.1944,1614.7],[-111.54163,34.19408,1616.2],[-111.54141,34.19399,1615.4],[-111.54117,34.19396,1614.9],[-111.5411,34.19382,1611.4],[-111.54126,34.19375,1614.6],[-111.54137,34.19351,1619.2],[-111.54179,34.19324,1627.2],[-111.54213,34.19285,1628.1],[-111.54216,34.19274,1628.0],[-111.54207,34.192,1631.2],[-111.54212,34.19136,1637.5],[-111.54203,34.19115,1638.9],[-111.54168,34.19071,1638.2],[-111.54165,34.19021,1636.8],[-111.54178,34.18956,1643.0],[-111.54159,34.18908,1635.8],[-111.5416,34.18889,1632.9],[-111.54147,34.18839,1627.7],[-111.54139,34.18826,1625.3],[-111.54124,34.18817,1623.0],[-111.54094,34.18819,1619.9],[-111.54083,34.18807,1618.4],[-111.54083,34.18754,1608.0],[-111.54112,34.18779,1604.3],[-111.54141,34.18749,1598.3],[-111.54156,34.18743,1596.5],[-111.5416,34.18734,1593.9],[-111.54147,34.18723,1591.1],[-111.54123,34.18725,1590.6],[-111.54087,34.18713,1588.6],[-111.54061,34.18689,1585.5],[-111.54079,34.18676,1586.0],[-111.54103,34.18668,1584.9],[-111.54166,34.18666,1582.4],[-111.54178,34.18661,1582.4],[-111.54214,34.18664,1578.7],[-111.54241,34.18584,1587.3],[-111.54244,34.1858,1587.2],[-111.5425,34.18582,1585.5],[-111.54241,34.18527,1594.9],[-111.54255,34.18461,1602.8],[-111.5425,34.18441,1607.1],[-111.54256,34.18421,1612.2],[-111.54249,34.18403,1613.4],[-111.54261,34.18385,1618.4],[-111.54266,34.18381,1618.8],[-111.54278,34.18382,1621.5],[-111.54316,34.18352,1630.1],[-111.54338,34.18344,1632.3],[-111.54362,34.18325,1633.3],[-111.54387,34.18295,1634.5],[-111.54388,34.18279,1637.1],[-111.54415,34.1825,1639.8],[-111.54438,34.18213,1645.4],[-111.54461,34.18203,1645.3],[-111.54502,34.18196,1643.5],[-111.54521,34.18171,1646.1],[-111.54569,34.18152,1649.8],[-111.54581,34.1814,1650.7],[-111.54598,34.18135,1651.8],[-111.54633,34.18088,1657.0],[-111.54661,34.18069,1660.8],[-111.5469,34.18058,1663.7],[-111.5471,34.18031,1666.3],[-111.54739,34.18013,1672.1],[-111.54801,34.17937,1687.3],[-111.5483,34.17918,1692.6],[-111.54834,34.17902,1694.8],[-111.54824,34.17834,1709.2],[-111.54857,34.17778,1724.7],[-111.54847,34.17766,1727.3],[-111.54812,34.17751,1734.1],[-111.54782,34.17728,1744.5],[-111.54753,34.17731,1750.6],[-111.54741,34.17729,1753.6],[-111.54739,34.17724,1754.9],[-111.54722,34.17725,1758.3],[-111.54708,34.17716,1763.2],[-111.54695,34.17668,1773.9],[-111.54679,34.1764,1780.6],[-111.54663,34.1752,1791.5],[-111.54632,34.17489,1794.6],[-111.54608,34.1749,1797.9],[-111.54517,34.17414,1801.5],[-111.54499,34.17396,1802.3],[-111.54444,34.17313,1803.0],[-111.54427,34.17299,1803.5],[-111.54381,34.17284,1803.5],[-111.54333,34.17287,1803.2],[-111.54304,34.17281,1804.7],[-111.54252,34.17292,1807.7],[-111.54191,34.17296,1813.7],[-111.54181,34.1729,1815.5],[-111.54151,34.17287,1818.8],[-111.54106,34.17292,1821.6],[-111.54068,34.17287,1823.0],[-111.5405,34.17273,1826.4],[-111.5403,34.17274,1827.0],[-111.54004,34.17265,1829.9],[-111.53967,34.17265,1831.9],[-111.53951,34.17259,1834.0],[-111.5394,34.17247,1836.6],[-111.53851,34.17272,1843.4],[-111.53824,34.17293,1846.2],[-111.53782,34.17302,1849.1],[-111.53765,34.17322,1851.0],[-111.53726,34.17325,1852.3],[-111.53706,34.17323,1852.6],[-111.53685,34.17311,1852.1],[-111.53648,34.17305,1851.8],[-111.53633,34.17295,1850.9],[-111.53579,34.1729,1849.9],[-111.53562,34.17273,1849.7],[-111.5354,34.17232,1852.3],[-111.53536,34.17235,1852.8],[-111.53491,34.17227,1855.7]],"cum_m":[0.0,38.2,70.8,82.7,93.4,115.7,141.8,170.3,180.7,197.5,252.4,306.7,372.7,387.9,410.5,433.0,489.2,534.9,546.0,562.5,578.2,598.4,620.3,658.4,686.8,719.1,748.7,781.9,810.6,821.4,828.1,845.0,856.1,883.2,957.8,972.2,977.2,999.2,1026.8,1042.6,1052.7,1063.1,1090.3,1140.9,1145.7,1177.2,1209.7,1215.3,1236.0,1267.9,1312.3,1335.1,1356.4,1416.3,1428.3,1438.4,1466.1,1510.6,1587.7,1647.4,1664.5,1690.4,1718.3,1733.7,1744.0,1768.2,1796.3,1902.3,1935.3,2027.2,2032.7,2061.0,2096.1,2111.2,2185.2,2229.1,2240.1,2267.9,2315.3,2360.7,2394.0,2421.3,2481.2,2532.1,2570.6,2607.4,2673.0,2678.8,2748.9,2766.5,2783.6,2840.5,2851.6,2868.0,2901.1,2917.7,2935.8,2963.8,3001.9,3024.5,3046.8,3063.7,3080.3,3108.9,3157.8,3211.2,3223.8,3306.5,3377.8,3402.6,3461.1,3516.8,3590.1,3646.2,3667.4,3724.2,3740.5,3757.5,3785.2,3801.9,3860.9,3899.4,3942.1,3957.4,3968.1,3985.2,4007.4,4043.1,4078.9,4100.9,4124.7,4182.7,4195.1,4228.3,4320.7,4325.9,4331.9,4393.6,4468.1,4490.8,4513.7,4534.7,4557.6,4564.0,4575.1,4623.4,4645.5,4676.1,4716.6,4734.4,4775.1,4821.4,4845.3,4883.8,4916.6,4965.6,4982.9,4999.5,5060.9,5094.2,5123.5,5158.7,5192.1,5294.0,5328.1,5346.2,5422.4,5491.7,5507.9,5544.2,5581.8,5608.7,5619.9,5625.8,5641.5,5657.8,5712.5,5746.9,5881.1,5925.9,5948.0,6066.9,6092.9,6198.2,6220.2,6265.7,6310.0,6337.5,6386.9,6443.2,6454.5,6482.3,6524.1,6559.5,6582.2,6600.7,6626.6,6660.6,6676.8,6693.6,6780.0,6814.1,6854.0,6881.2,6917.2,6935.8,6959.3,6993.9,7011.7,7061.7,7086.2,7136.1,7141.0,7183.4],"derived":{"arc":{"track":"38742_Fuller_See.gpx#0","from":1898,"to":2297,"reversed":true},"source":{"file":"38742_Fuller_See.gpx","date":"2017-12-29"},"elevation":"USGS 3DEP, bilinear (see tools/elevation.py)","gain_threshold_m":3.0,"cleaning":{"spike_perp_m":25.0,"arrive_m":10.0,"consensus_near_m":5.0,"consensus_far_m":10.0,"consensus_step_m":5.0,"simplify_m":3.3},"consensus":{"passes":["38742_Fuller_See.gpx#0","48331_Upper_Maza.gpx#0"],"voted_fraction":0.003,"mean_shift_m":0.0,"max_shift_m":0.24},"trimmed_points":{}}}