{"type":"LineString","coordinates":[[-111.491423,34.11258,1858.9],[-111.491453,34.112731,1857.2],[-111.49135,34.112989,1854.5],[-111.491365,34.11321,1850.9],[-111.49145,34.113069,1850.1],[-111.491554,34.11302,1848.8],[-111.491881,34.113064,1846.7],[-111.4921,34.1129,1843.1]],"cum_m":[0.0,17.0,47.2,71.8,89.4,100.4,130.9,158.1],"derived":{"arc":{"track":"RS_NorthForkFallsofDead_174147.gpx#0","from":1960,"to":1982,"reversed":false},"source":{"file":"RS_NorthForkFallsofDead_174147.gpx","date":"2020-03-21"},"elevation":"USGS 3DEP, bilinear (see tools/elevation.py)","gain_threshold_m":3.0,"cleaning":{"spike_perp_m":25.0,"arrive_m":10.0,"consensus_near_m":5.0,"consensus_far_m":10.0,"consensus_step_m":5.0,"simplify_m":3.3},"consensus":{"passes":["33886_Rock_Creek.gpx#3","35935_Mazatzal_P.gpx#0","37747_Club_Ranch.gpx#0","RS_NorthForkFallsofDead_174147.gpx#0"],"voted_fraction":1.0,"mean_shift_m":1.32,"max_shift_m":3.57},"trimmed_points":{"0V":5}}}