{"type":"LineString","coordinates":[[-111.48177,33.96671,1401.1],[-111.48164,33.96683,1404.6],[-111.48161,33.96697,1407.6],[-111.48206,33.96785,1404.8],[-111.48207,33.96854,1409.7],[-111.48231,33.96949,1412.2],[-111.48207,33.97038,1416.7],[-111.48183,33.97056,1417.9],[-111.48147,33.97106,1419.7],[-111.48139,33.97125,1421.0],[-111.48185,33.97171,1429.2],[-111.48224,33.97222,1430.7],[-111.48241,33.97261,1432.6],[-111.48268,33.97294,1437.9],[-111.48291,33.97334,1434.6],[-111.48303,33.97344,1436.3],[-111.48306,33.97363,1435.6],[-111.48299,33.97357,1436.0],[-111.48313,33.97365,1438.6],[-111.48304,33.97355,1435.2],[-111.48309,33.97367,1437.1],[-111.4831,33.9736,1436.3],[-111.48307,33.97373,1436.9],[-111.48322,33.97372,1441.1]],"cum_m":[0.0,17.9,33.7,140.0,216.8,324.7,426.1,455.9,520.7,543.1,609.5,676.7,722.8,767.1,816.4,832.1,853.4,862.7,878.4,892.2,906.4,914.2,928.9,942.8],"derived":{"arc":{"track":"36991_S_Mazatzal.gpx#0","from":1744,"to":1795,"reversed":true},"source":{"file":"36991_S_Mazatzal.gpx","date":"2017-06-12"},"elevation":"USGS 3DEP, bilinear (see tools/elevation.py)","gain_threshold_m":3.0,"cleaning":{"spike_perp_m":25.0,"simplify_m":3.3}}}